DML COMAND-UPDATE




mysql> select * from PRODUCT;
+------+----------------+-------+
| P_ID | P_NAME         | PRICE |
+------+----------------+-------+
|   10 | CRICKET_BAT    | 10000 |
|   11 | CRICKET_BALL   |  1000 |
|   12 | CRICKET_PAD    |  2000 |
|   13 | CRICKET HELMET |  4000 |
|   14 | STUMPS         |  1000 |
|   15 | GLOWS          |   100 |
|   16 | CAP            |    80 |
|   17 | JERSY          |   120 |
+------+----------------+-------+
8 rows in set (0.00 sec)
--------------------------------------
--------------------------------------


1.Update the price of a particular product.

mysql> update PRODUCT set PRICE=12000 where P_ID=10;
Query OK, 1 row affected (0.06 sec)
Rows matched: 1  Changed: 1  Warnings: 0

mysql> update PRODUCT set PRICE=500 where P_ID=11;
Query OK, 1 row affected (0.50 sec)
Rows matched: 1  Changed: 1  Warnings: 0

mysql> select * from PRODUCT;
+------+----------------+-------+
| P_ID | P_NAME         | PRICE |
+------+----------------+-------+
|   10 | CRICKET_BAT    | 12000 |
|   11 | CRICKET_BALL   |   500 |
|   12 | CRICKET_PAD    |  2000 |
|   13 | CRICKET HELMET |  4000 |
|   14 | STUMPS         |  1000 |
|   15 | GLOWS          |   100 |
|   16 | CAP            |    80 |
|   17 | JERSY          |   120 |
+------+----------------+-------+
8 rows in set (0.01 sec)
------------------------------------
------------------------------------

2.Change the name of city ‘calicut’ to ‘kozhikode’ in the customer table. 


mysql> select * from CUST;
+---------+--------+------------+------+-------------+
| CUST_ID | NAME   | ADDRESS    | CITY | PH_NO       |
+---------+--------+------------+------+-------------+
|       1 | ASWIN  | KIZHAKKOTH | KKD  | 9743787277  |
|       2 | ARJUN  | PANNUR     | EKM  | 9743787276  |
|       3 | ARUN   | VATOLI     | TVM  | 9743787272  |
|       4 | JITHU  | VATOLI     | WND  |             |
|       5 | JUNAID | KODUVALLY  | MLP  | 9876589986  |
+---------+--------+------------+------+-------------+
5 rows in set (0.00 sec)

mysql> 
mysql> update CUST set CITY='KOZHIKODE' where CUST_ID=1;
Query OK, 1 row affected (0.51 sec)
Rows matched: 1  Changed: 1  Warnings: 0

mysql> select * from CUST;
+---------+--------+------------+-----------+-------------+
| CUST_ID | NAME   | ADDRESS    | CITY      | PH_NO       |
+---------+--------+------------+-----------+-------------+
|       1 | ASWIN  | KIZHAKKOTH | KOZHIKODE | 9743787277  |
|       2 | ARJUN  | PANNUR     | EKM       | 9743787276  |
|       3 | ARUN   | VATOLI     | TVM       | 9743787272  |
|       4 | JITHU  | VATOLI     | WND       |             |
|       5 | JUNAID | KODUVALLY  | MLP       | 9876589986  |
+---------+--------+------------+-----------+-------------+
5 rows in set (0.00 sec)
----------------------------------------------------------------
-----------------------------------------------------------------

3.Update all prices with 2% of its original price.


mysql> update PRODUCT set PRICE=PRICE*(2/100);
Query OK, 8 rows affected (0.22 sec)
Rows matched: 8  Changed: 8  Warnings: 0

mysql> select * from PRODUCT;
+------+----------------+-------+
| P_ID | P_NAME         | PRICE |
+------+----------------+-------+
|   10 | CRICKET_BAT    |   240 |
|   11 | CRICKET_BALL   |    10 |
|   12 | CRICKET_PAD    |    40 |
|   13 | CRICKET HELMET |    80 |
|   14 | STUMPS         |    20 |
|   15 | GLOWS          |     2 |
|   16 | CAP            |   1.6 |
|   17 | JERSY          |   2.4 |
+------+----------------+-------+
8 rows in set (0.00 sec)

-------------------------------------
-------------------------------------

4.Change the address, city, phone number of a particular customer.


mysql> update CUST set ADDRESS='KODUVALLY',CITY='WAYANAD',PH_NO='9856768113' where CUST_ID=2;
Query OK, 1 row affected (0.52 sec)
Rows matched: 1  Changed: 1  Warnings: 0

mysql> select * from CUST;
+---------+--------+------------+-----------+-------------+
| CUST_ID | NAME   | ADDRESS    | CITY      | PH_NO       |
+---------+--------+------------+-----------+-------------+
|       1 | ASWIN  | KIZHAKKOTH | KOZHIKODE | 9743787277  |
|       2 | ARJUN  | KODUVALLY  | WAYANAD   | 9856768113  |
|       3 | ARUN   | VATOLI     | TVM       | 9743787272  |
|       4 | JITHU  | VATOLI     | WND       |             |
|       5 | JUNAID | KODUVALLY  | MLP       | 9876589986  |
+---------+--------+------------+-----------+-------------+
5 rows in set (0.00 sec)

--------------------------------------------------------------
---------------------------------------------------------------

5.Change the quantity of a purchased product of inv_id ‘101’

mysql> update INVOICE_ITEMS set QUANTITY=10 WHERE INV_ID=101;
Query OK, 2 rows affected (0.05 sec)
Rows matched: 2  Changed: 2  Warnings: 0

mysql> select * from INVOICE_ITEMS;
+--------+------+----------+
| INV_ID | P_ID | QUANTITY |
+--------+------+----------+
|    100 |   10 |        2 |
|    101 |   10 |       10 |
|    102 |   11 |        5 |
|    103 |   10 |        2 |
|    104 |   12 |        2 |
|    100 |   13 |        6 |
|    101 |   13 |       10 |
|    102 |   15 |        5 |
|    104 |   16 |        6 |
+--------+------+----------+
9 rows in set (0.00 sec)

mysql> 

